{
  "candidate_count": 3,
  "candidates": [
    {
      "candidate_id": "chronos_2_zero_shot",
      "environment_sha256": "bef86b1910752a4f64f8a68850e40bf1f24a25bde5bd3b7a84535f7c7fd73959",
      "execution_commit": "5a5dce0d43f4f1de8c5cd8365263a1d007b105d1",
      "hosted_api_used": false,
      "license_verified": true,
      "model_id": "amazon/chronos-2",
      "paid_api_used": false,
      "provider": "Amazon",
      "python_version": "3.12.13",
      "remote_code_trust_used": false,
      "requested_model_revision": "95a9710",
      "resolved_model_revision": "95a9710e2596287d08352589f42634fa5abdf0a7",
      "source_license": "Apache-2.0",
      "source_repository": "amazon-science/chronos-forecasting",
      "source_revision": "7dc4435706a4454feb79df44ca9f33631f3027bf",
      "source_revision_verified": true,
      "weight_sha256": "ddcda3c7508bf2528087723e98a20707cc04b7f370ae275a9fd88078ddba4f42",
      "weight_sha256_verified": true,
      "weights_license": "Apache-2.0"
    },
    {
      "candidate_id": "timesfm_2_5_zero_shot",
      "environment_sha256": "d46f9f3e66e77e60d2fb4a459e68d5e2f6546f940273954a716df0efc942be1a",
      "execution_commit": "5a5dce0d43f4f1de8c5cd8365263a1d007b105d1",
      "hosted_api_used": false,
      "license_verified": true,
      "model_id": "google/timesfm-2.5-200m-pytorch",
      "paid_api_used": false,
      "provider": "Google Research",
      "python_version": "3.12.13",
      "remote_code_trust_used": false,
      "requested_model_revision": "1d952420fba87f3c6dee4f240de0f1a0fbc790e3",
      "resolved_model_revision": "1d952420fba87f3c6dee4f240de0f1a0fbc790e3",
      "source_license": "Apache-2.0",
      "source_repository": "google-research/timesfm",
      "source_revision": "3dae50b20d7a724981e8ea36cda75578f80dd2dc",
      "source_revision_verified": true,
      "weight_sha256": "2f776efe6245e42b24bc4153ffdf61810140210e4bd3b01fb21f7aa779ab6ce8",
      "weight_sha256_verified": true,
      "weights_license": "Apache-2.0"
    },
    {
      "candidate_id": "moirai_2_research_zero_shot",
      "environment_sha256": "d0553c8952263a973983a006ab7ddd8182314bb7c908b5651a324502165ed8c3",
      "execution_commit": "5a5dce0d43f4f1de8c5cd8365263a1d007b105d1",
      "hosted_api_used": false,
      "license_verified": true,
      "model_id": "Salesforce/moirai-2.0-R-small",
      "paid_api_used": false,
      "provider": "Salesforce AI Research",
      "python_version": "3.12.13",
      "remote_code_trust_used": false,
      "requested_model_revision": "c1b8789901bf60568fc4b2726f7d3aa256ac4ac8",
      "resolved_model_revision": "c1b8789901bf60568fc4b2726f7d3aa256ac4ac8",
      "source_license": "Apache-2.0",
      "source_repository": "SalesforceAIResearch/uni2ts",
      "source_revision": "cfd46d4510ed8896f263116f32928eede05b0a75",
      "source_revision_verified": true,
      "weight_sha256": "fb5652a3db8ea572606221b7cb1e77bb8962b168e4d4cc752cf31ceb04074669",
      "weight_sha256_verified": true,
      "weights_license": "CC-BY-NC-4.0"
    }
  ],
  "gate": "6D",
  "schema_version": "1.0.0",
  "subgate": "6D2"
}
